{
  "$schema": "https://json-schema.org/draft/2020-12/schema",
  "$id": "https://digital-souls.local/schemas/profile-v1.schema.json",
  "title": "Digital Souls 環境プロファイル V1",
  "type": "object",
  "additionalProperties": false,
  "required": ["schemaVersion", "name", "description", "readyGate", "dependencies"],
  "properties": {
    "schemaVersion": { "const": 1 },
    "name": {
      "type": "string",
      "pattern": "^[a-z0-9]+(?:-[a-z0-9]+)*$"
    },
    "description": { "type": "string", "minLength": 1 },
    "readyGate": {
      "type": "object",
      "additionalProperties": false,
      "required": ["baseUrl"],
      "properties": {
        "baseUrl": { "$ref": "#/$defs/managedOrigin" }
      }
    },
    "dependencies": {
      "type": "object",
      "additionalProperties": false,
      "required": ["frontend", "backend", "ollama", "voicevox", "whisper", "chroma"],
      "properties": {
        "frontend": { "$ref": "#/$defs/frontendDependency" },
        "backend": { "$ref": "#/$defs/backendDependency" },
        "ollama": { "$ref": "#/$defs/ollamaDependency" },
        "voicevox": { "$ref": "#/$defs/voicevoxDependency" },
        "livekit": { "$ref": "#/$defs/livekitDependency" },
        "irodori": { "$ref": "#/$defs/irodoriDependency" },
        "whisper": { "$ref": "#/$defs/whisperDependency" },
        "chroma": { "$ref": "#/$defs/inProcessDependency" }
      },
      "allOf": [
        {
          "if": {
            "properties": {
              "backend": {
                "properties": { "mode": { "const": "real" } },
                "required": ["mode"]
              }
            },
            "required": ["backend"]
          },
          "else": {
            "properties": {
              "ollama": { "$ref": "#/$defs/disabledDependency" },
              "voicevox": { "$ref": "#/$defs/disabledDependency" },
              "livekit": { "$ref": "#/$defs/disabledDependency" },
              "irodori": { "$ref": "#/$defs/disabledDependency" },
              "whisper": { "$ref": "#/$defs/disabledDependency" },
              "chroma": { "$ref": "#/$defs/disabledDependency" }
            }
          }
        }
      ]
    }
  },
  "allOf": [
    {
      "if": { "properties": { "name": { "enum": ["integration-irodori-cuda-graph", "integration-irodori-memory-reference"] } }, "required": ["name"] },
      "then": { "properties": { "dependencies": { "properties": { "irodori": { "properties": {
        "baseUrl": { "enum": ["http://127.0.0.1:50026", "http://127.0.0.1:50026/"] }
      } } } } } }
    },
    {
      "if": { "properties": { "name": { "enum": ["integration-irodori-ollama-candidate", "integration-irodori-cuda-graph", "integration-irodori-memory-reference"] } }, "required": ["name"] },
      "then": { "properties": { "dependencies": { "properties": { "ollama": { "properties": {
        "baseUrl": { "enum": ["http://127.0.0.1:11534", "http://127.0.0.1:11534/"] }
      } } } } } },
      "else": { "properties": { "dependencies": { "properties": { "ollama": { "properties": {
        "baseUrl": { "enum": ["http://localhost:11434", "http://localhost:11434/", "http://127.0.0.1:11434", "http://127.0.0.1:11434/"] }
      } } } } } }
    },
    {
      "if": { "properties": { "name": { "const": "integration-voice-pcm" } }, "required": ["name"] },
      "then": { "properties": { "dependencies": { "properties": { "whisper": { "properties": {
        "baseUrl": { "enum": ["http://127.0.0.1:50023", "http://127.0.0.1:50023/"] }
      } } } } } },
      "else": {
        "if": { "properties": { "name": { "const": "dev-stt-validation" } }, "required": ["name"] },
        "then": { "properties": { "dependencies": { "properties": { "whisper": { "properties": {
          "baseUrl": { "enum": ["http://127.0.0.1:50025", "http://127.0.0.1:50025/"] }
        } } } } } },
        "else": { "properties": { "dependencies": { "properties": { "whisper": { "properties": {
          "baseUrl": { "enum": ["http://127.0.0.1:50022", "http://127.0.0.1:50022/"] }
        } } } } } }
      }
    }
  ],
  "$defs": {
    "managedOrigin": {
      "type": "string",
      "format": "uri",
      "pattern": "^[hH][tT][tT][pP]://(?:[lL][oO][cC][aA][lL][hH][oO][sS][tT]|127\\.(?:0|[1-9][0-9]?|1[0-9]{2}|2[0-4][0-9]|25[0-5])\\.(?:0|[1-9][0-9]?|1[0-9]{2}|2[0-4][0-9]|25[0-5])\\.(?:0|[1-9][0-9]?|1[0-9]{2}|2[0-4][0-9]|25[0-5])|\\[(?:(?=[0:]*1\\])(?:(?:[0-9A-Fa-f]{1,4}:){7}[0-9A-Fa-f]{1,4}|(?:[0-9A-Fa-f]{1,4}:){1,7}:|(?:[0-9A-Fa-f]{1,4}:){1,6}:[0-9A-Fa-f]{1,4}|(?:[0-9A-Fa-f]{1,4}:){1,5}(?::[0-9A-Fa-f]{1,4}){1,2}|(?:[0-9A-Fa-f]{1,4}:){1,4}(?::[0-9A-Fa-f]{1,4}){1,3}|(?:[0-9A-Fa-f]{1,4}:){1,3}(?::[0-9A-Fa-f]{1,4}){1,4}|(?:[0-9A-Fa-f]{1,4}:){1,2}(?::[0-9A-Fa-f]{1,4}){1,5}|[0-9A-Fa-f]{1,4}:(?:(?::[0-9A-Fa-f]{1,4}){1,6})|:(?:(?::[0-9A-Fa-f]{1,4}){1,7}|:))|(?:0{1,4}:){6}0\\.0\\.0\\.1|::(?:0{1,4}:){0,5}0\\.0\\.0\\.1|0{1,4}::(?:0{1,4}:){0,4}0\\.0\\.0\\.1|(?:0{1,4}:){1}0{1,4}::(?:0{1,4}:){0,3}0\\.0\\.0\\.1|(?:0{1,4}:){2}0{1,4}::(?:0{1,4}:){0,2}0\\.0\\.0\\.1|(?:0{1,4}:){3}0{1,4}::(?:0{1,4}:){0,1}0\\.0\\.0\\.1|(?:0{1,4}:){4}0{1,4}::0\\.0\\.0\\.1)\\]):(?:[1-9]|[1-9][0-9]{1,3}|[1-5][0-9]{4}|6[0-4][0-9]{3}|65[0-4][0-9]{2}|655[0-2][0-9]|6553[0-5])/?$"
    },
    "connectionFields": {
      "baseUrl": {
        "type": "string",
        "format": "uri",
        "pattern": "^[hH][tT][tT][pP][sS]?://(?![^?#]*%(?![0-9A-Fa-f]{2}))(?:\\[(?:(?:[0-9A-Fa-f]{1,4}:){7}[0-9A-Fa-f]{1,4}|(?:[0-9A-Fa-f]{1,4}:){1,7}:|(?:[0-9A-Fa-f]{1,4}:){1,6}:[0-9A-Fa-f]{1,4}|(?:[0-9A-Fa-f]{1,4}:){1,5}(?::[0-9A-Fa-f]{1,4}){1,2}|(?:[0-9A-Fa-f]{1,4}:){1,4}(?::[0-9A-Fa-f]{1,4}){1,3}|(?:[0-9A-Fa-f]{1,4}:){1,3}(?::[0-9A-Fa-f]{1,4}){1,4}|(?:[0-9A-Fa-f]{1,4}:){1,2}(?::[0-9A-Fa-f]{1,4}){1,5}|[0-9A-Fa-f]{1,4}:(?:(?::[0-9A-Fa-f]{1,4}){1,6})|:(?:(?::[0-9A-Fa-f]{1,4}){1,7}|:)|(?:[0-9A-Fa-f]{1,4}:){6}(?:(?:25[0-5]|2[0-4][0-9]|1[0-9]{2}|[1-9]?[0-9])\\.){3}(?:25[0-5]|2[0-4][0-9]|1[0-9]{2}|[1-9]?[0-9])|::(?:[fF]{4}(?::0{1,4})?:)?(?:(?:25[0-5]|2[0-4][0-9]|1[0-9]{2}|[1-9]?[0-9])\\.){3}(?:25[0-5]|2[0-4][0-9]|1[0-9]{2}|[1-9]?[0-9])|(?:[0-9A-Fa-f]{1,4}:){1,4}:(?:(?:25[0-5]|2[0-4][0-9]|1[0-9]{2}|[1-9]?[0-9])\\.){3}(?:25[0-5]|2[0-4][0-9]|1[0-9]{2}|[1-9]?[0-9]))\\]|[^/?#\\s:@\\[\\]]+)(?::[0-9]+)?(?:/[^?#\\s]*)?(?![\\s\\S])"
      },
      "readinessPath": {
        "type": "string",
        "pattern": "^/(?:[A-Za-z0-9._~!$&'()*+,;=:@]|%[0-9A-Fa-f]{2})+(?:/(?:[A-Za-z0-9._~!$&'()*+,;=:@]|%[0-9A-Fa-f]{2})*)*$|^/$"
      }
    },
    "disabledDependency": {
      "type": "object",
      "additionalProperties": false,
      "required": ["mode", "source"],
      "properties": {
        "mode": { "const": "disabled" },
        "source": { "type": "null" }
      }
    },
    "frontendDependency": {
      "oneOf": [
        { "$ref": "#/$defs/frontendManagedDependency" },
        { "$ref": "#/$defs/httpExternalDependency" },
        { "$ref": "#/$defs/disabledDependency" }
      ]
    },
    "frontendManagedDependency": {
      "type": "object",
      "additionalProperties": false,
      "required": ["mode", "source", "baseUrl", "readinessPath"],
      "properties": {
        "mode": { "const": "real" },
        "source": { "const": "managed" },
        "baseUrl": { "$ref": "#/$defs/managedOrigin" },
        "readinessPath": { "const": "/" }
      }
    },
    "httpExternalDependency": {
      "type": "object",
      "additionalProperties": false,
      "required": ["mode", "source", "baseUrl", "readinessPath"],
      "properties": {
        "mode": { "const": "real" },
        "source": { "const": "external" },
        "baseUrl": { "$ref": "#/$defs/connectionFields/baseUrl" },
        "readinessPath": { "$ref": "#/$defs/connectionFields/readinessPath" }
      }
    },
    "voicevoxDependency": {
      "oneOf": [
        { "$ref": "#/$defs/voicevoxHttpDependency" },
        { "$ref": "#/$defs/disabledDependency" }
      ]
    },
    "irodoriDependency": {
      "oneOf": [
        {
          "allOf": [
            {
              "$ref": "#/$defs/httpExternalDependency"
            },
            {
              "properties": {
                "readinessPath": {
                  "const": "/health/ready"
                }
              }
            }
          ]
        },
        {
          "$ref": "#/$defs/disabledDependency"
        }
      ]
    },
    "livekitDependency": {
      "oneOf": [
        { "$ref": "#/$defs/httpExternalDependency" },
        { "$ref": "#/$defs/disabledDependency" }
      ]
    },
    "ollamaDependency": {
      "oneOf": [
        { "$ref": "#/$defs/ollamaHttpDependency" },
        { "$ref": "#/$defs/disabledDependency" }
      ]
    },
    "ollamaHttpDependency": {
      "type": "object",
      "additionalProperties": false,
      "required": ["mode", "source", "baseUrl", "readinessPath"],
      "properties": {
        "mode": { "const": "real" },
        "source": { "enum": ["managed", "external"] },
        "baseUrl": {
          "enum": [
            "http://localhost:11434",
            "http://localhost:11434/",
            "http://127.0.0.1:11434",
            "http://127.0.0.1:11434/",
            "http://127.0.0.1:11534",
            "http://127.0.0.1:11534/"
          ]
        },
        "readinessPath": { "const": "/api/tags" }
      }
    },
    "voicevoxHttpDependency": {
      "type": "object",
      "additionalProperties": false,
      "required": ["mode", "source", "baseUrl", "readinessPath"],
      "properties": {
        "mode": { "const": "real" },
        "source": { "enum": ["managed", "external"] },
        "baseUrl": {
          "enum": [
            "http://127.0.0.1:50021",
            "http://127.0.0.1:50021/"
          ]
        },
        "readinessPath": { "const": "/version" }
      }
    },
    "whisperDependency": {
      "oneOf": [
        { "$ref": "#/$defs/whisperExternalDependency" },
        { "$ref": "#/$defs/inProcessRealDependency" },
        { "$ref": "#/$defs/disabledDependency" }
      ]
    },
    "whisperExternalDependency": {
      "type": "object",
      "additionalProperties": false,
      "required": ["mode", "source", "baseUrl", "readinessPath"],
      "properties": {
        "mode": { "const": "real" },
        "source": { "const": "external" },
        "baseUrl": {
          "enum": [
            "http://127.0.0.1:50022",
            "http://127.0.0.1:50022/",
            "http://127.0.0.1:50023",
            "http://127.0.0.1:50023/",
            "http://127.0.0.1:50025",
            "http://127.0.0.1:50025/"
          ]
        },
        "readinessPath": { "const": "/health/ready" }
      }
    },
    "backendDependency": {
      "oneOf": [
        { "$ref": "#/$defs/backendManagedDependency" },
        { "$ref": "#/$defs/httpExternalDependency" },
        { "$ref": "#/$defs/browserMockDependency" },
        { "$ref": "#/$defs/disabledDependency" }
      ]
    },
    "backendManagedDependency": {
      "type": "object",
      "additionalProperties": false,
      "required": ["mode", "source", "baseUrl", "readinessPath", "reload"],
      "properties": {
        "mode": { "const": "real" },
        "source": { "const": "managed" },
        "baseUrl": { "$ref": "#/$defs/managedOrigin" },
        "readinessPath": { "const": "/health/ready" },
        "reload": { "type": "boolean" }
      }
    },
    "browserMockDependency": {
      "type": "object",
      "additionalProperties": false,
      "required": ["mode", "source"],
      "properties": {
        "mode": { "const": "mock" },
        "source": { "const": "browser" }
      }
    },
    "inProcessDependency": {
      "oneOf": [
        { "$ref": "#/$defs/inProcessRealDependency" },
        { "$ref": "#/$defs/disabledDependency" }
      ]
    },
    "inProcessRealDependency": {
      "type": "object",
      "additionalProperties": false,
      "required": ["mode", "source"],
      "properties": {
        "mode": { "const": "real" },
        "source": { "const": "in_process" }
      }
    }
  }
}
