{
  "schemaVersion": 1,
  "name": "dev-stt-validation",
  "description": "共有Whisperを変更しないdev専用STT修正検証",
  "readyGate": {
    "baseUrl": "http://127.0.0.1:4174"
  },
  "dependencies": {
    "frontend": {
      "mode": "real",
      "source": "managed",
      "baseUrl": "http://localhost:5173",
      "readinessPath": "/"
    },
    "backend": {
      "mode": "real",
      "source": "managed",
      "baseUrl": "http://localhost:8000",
      "readinessPath": "/health/ready",
      "reload": true
    },
    "ollama": {
      "mode": "real",
      "source": "external",
      "baseUrl": "http://localhost:11434",
      "readinessPath": "/api/tags"
    },
    "voicevox": {
      "mode": "real",
      "source": "external",
      "baseUrl": "http://127.0.0.1:50021",
      "readinessPath": "/version"
    },
    "livekit": {
      "mode": "real",
      "source": "external",
      "baseUrl": "http://127.0.0.1:7880",
      "readinessPath": "/"
    },
    "whisper": {
      "mode": "real",
      "source": "external",
      "baseUrl": "http://127.0.0.1:50025",
      "readinessPath": "/health/ready"
    },
    "chroma": {
      "mode": "real",
      "source": "in_process"
    }
  }
}
