{
  "schemaVersion": 1,
  "name": "integration-irodori-cuda-graph-fault",
  "description": "高速化TTS候補の再接続計測。専用bridgeと専用推論候補だけへ接続する。",
  "readyGate": {
    "baseUrl": "http://127.0.0.1:18574"
  },
  "dependencies": {
    "frontend": {
      "mode": "real",
      "source": "managed",
      "baseUrl": "http://localhost:18573",
      "readinessPath": "/"
    },
    "backend": {
      "mode": "real",
      "source": "managed",
      "baseUrl": "http://localhost:18500",
      "readinessPath": "/health/ready",
      "reload": true
    },
    "ollama": {
      "mode": "real",
      "source": "external",
      "baseUrl": "http://127.0.0.1:11534",
      "readinessPath": "/api/tags"
    },
    "voicevox": {
      "mode": "real",
      "source": "external",
      "baseUrl": "http://127.0.0.1:50021",
      "readinessPath": "/version"
    },
    "livekit": {
      "mode": "real",
      "source": "external",
      "baseUrl": "http://127.0.0.1:19880",
      "readinessPath": "/"
    },
    "whisper": {
      "mode": "real",
      "source": "external",
      "baseUrl": "http://127.0.0.1:50022",
      "readinessPath": "/health/ready"
    },
    "chroma": {
      "mode": "disabled",
      "source": null
    },
    "irodori": {
      "mode": "real",
      "source": "external",
      "baseUrl": "http://127.0.0.1:50026",
      "readinessPath": "/health/ready"
    }
  }
}
